{
  "artifact": {
    "build_inputs": {
      "onnx_sha256": "4ed9006c47bb1eb8521eed0f8b22aa49003a8013c8e4adf5db414f7c8e927534",
      "precision": "fp32",
      "tf32": false,
      "workspace_mib": 512
    },
    "format": "tensorrt-engine",
    "path": "artifacts\\squeezenet1.1-fp32.engine",
    "sha256": "0b174885daa963f84bceff434b072714b399ba7ec8d8de2e4c8275a58d4ad6a0",
    "size_bytes": 7702460,
    "tools": {
      "container": "nvcr.io/nvidia/tensorrt:25.02-py3",
      "container_digest": "sha256:814325e2b8a653f354c30bbcf5ecc8d4c780cf878a88a320ae648fbfdd9dd82d",
      "tensorrt": "10.8.0"
    }
  },
  "checks": [
    {
      "evidence": {
        "path": "artifacts\\squeezenet1.1-fp32.engine"
      },
      "id": "artifact.exists",
      "message": "artifact file exists",
      "status": "pass"
    },
    {
      "evidence": {
        "observed": 7702460
      },
      "id": "artifact.size",
      "message": "artifact size matches manifest",
      "status": "pass"
    },
    {
      "evidence": {
        "sha256": "0b174885daa963f84bceff434b072714b399ba7ec8d8de2e4c8275a58d4ad6a0"
      },
      "id": "artifact.sha256",
      "message": "artifact SHA-256 matches manifest",
      "status": "pass"
    },
    {
      "evidence": {
        "count": 1
      },
      "id": "contract.inputs",
      "message": "artifact inputs match manifest",
      "status": "pass"
    },
    {
      "evidence": {
        "count": 1
      },
      "id": "contract.outputs",
      "message": "artifact outputs match manifest",
      "status": "pass"
    },
    {
      "evidence": {
        "format": "tensorrt-engine"
      },
      "id": "artifact.format",
      "message": "observed artifact format matches manifest",
      "status": "pass"
    },
    {
      "evidence": {
        "observed": {
          "compute_capability": "12.0",
          "container_digest": "sha256:814325e2b8a653f354c30bbcf5ecc8d4c780cf878a88a320ae648fbfdd9dd82d",
          "cuda_driver": "595.79",
          "gpu_name": "NVIDIA GeForce RTX 5050",
          "tensorrt": "10.8.0"
        }
      },
      "id": "environment.compatibility",
      "message": "observed environment satisfies manifest",
      "status": "pass"
    },
    {
      "evidence": {
        "compared_values": 1000,
        "max_absolute_error": 2.86102294921875e-06
      },
      "id": "runtime.equivalence",
      "message": "target output is within declared tolerance",
      "status": "pass"
    },
    {
      "evidence": {
        "latency_mean_seconds": 0.00035659499999999997,
        "latency_median_seconds": 0.000324608,
        "latency_p95_seconds": 0.000524353,
        "measured_runs": 100,
        "memory_scope": "not_peak; trtexec benchmark log does not expose process peak GPU memory",
        "source": "trtexec",
        "throughput_runs_per_second": 2795.71,
        "transfer_scope": "device_only",
        "warmup_duration_ms": 200
      },
      "id": "benchmark.workload",
      "message": "benchmark workload evidence supplied by the declared runtime harness",
      "status": "pass"
    }
  ],
  "evidence": {
    "container_runtime": {
      "cuda_binding": "cuda-python",
      "machine": "x86_64",
      "optimization_profiles": [
        {
          "index": 0,
          "inputs": {
            "data": {
              "max": [
                1,
                3,
                224,
                224
              ],
              "min": [
                1,
                3,
                224,
                224
              ],
              "opt": [
                1,
                3,
                224,
                224
              ]
            }
          }
        }
      ],
      "python": "3.12.3",
      "runtime": "tensorrt",
      "system": "Linux",
      "tensorrt_version": "10.8.0.43"
    },
    "fixture_sha256": "3161e1f639bd8c78b14164b87c3fb0be8aeb821aa715fcc0cab2d93353242d89",
    "reference_output_sha256": "9b9e35c2d6a1191685178087ce91bd352fadcebc97af24cb7b88ecf75fec0f06"
  },
  "limitations": [],
  "manifest_digest": "e5a33c0b09061afb6c54001008d97fa93f3ada9496c8337e4a720bed0dcf9dbe",
  "schema_version": "1",
  "status": "pass"
}
